{
   "$schema": "https://raw.githubusercontent.com/zatrit/Funkin-REGEN-ext/master/schemas/stage.json",
   "camZoom": 1.05,
   "library": "week2",
   "name": "stage",
   "objects": [
      {
         "defaultAnimation":"",
         "active": false,
         "animations": [
            {
               "name": "idle",
               "fps": 24,
               "loop": false,
               "prefix": "halloweem bg0"
            },
            {
               "name": "lightning",
               "fps": 24,
               "loop": false,
               "prefix": "halloweem bg lightning strike"
            }
         ],
         "name": "halloweenBG",
         "position": {"x": -200,"y": -100},
         "scrollFactor": {"x": 0.9,"y": 0.9},
         "map": true,
         "scale": {
             "x": 1.1,
             "y": 1.1
         },
         "file":"halloween_bg"
      }
   ]
}