{
   "$schema": "https://raw.githubusercontent.com/zatrit/Funkin-REGEN-ext/master/schemas/stage.json",
   "camZoom": 0.9,
   "library": "shared",
   "name": "stage",
   "objects": [
      {
         "defaultAnimation":"",
         "active": false,
         "animations": [],
         "name": "bg",
         "position": {"x": -600,"y": -200},
         "scrollFactor": {"x": 0.9,"y": 0.9},
         "map": false,
         "scale": {
             "x": 1.1,
             "y": 1.1
         },
         "file":"stageback"
      },
      {
         "defaultAnimation":"",
         "active": false,
         "animations": [],
         "name": "stageFront",
         "position": {"x": -650,"y": 600},
         "scrollFactor": {"x": 0.9,"y": 0.9},
         "map": false,
         "scale": {
             "x": 1.1,
             "y": 1.1
         },
         "file":"stagefront"
      },
      {
         "defaultAnimation":"",
         "active": false,
         "animations": [],
         "name": "stageCurtains",
         "position": {"x": -500,"y": -300},
         "scrollFactor": {"x": 1.3,"y": 1.3},
         "map": false,
         "scale": {
             "x": 0.9,
             "y": 0.9
         },
         "file":"stagecurtains"
      }
   ]
}